"N";"DATA DA EXPEDIÇÃO";"CONCESSIONARIOS";"RESIDENCIA";"OBJECTO"
"3.189";"15";"Alexandre Speltz.";"Idem";"Apparelho hydro-pneumatico, para elevar automa- ticamente agua ou outro liquido, denominado -Elevador Speltz."
"3.190";"18";"Antonio Nonato";"Estado de Minas Geraes.";"Nova fechadura de segredo."
"3.191";"18";"Francisco Dutra da Rosa Junior e Pedro Boix.";"Capital Federal.";"Medidor de gaz aperfeiçoado, denominado - Me- didor Boix Rosa."
"3.192";"18";"Francisco de Medeiros Muniz.";"Idem";"Enveloppe instructor."
"3.193";"14 novembro";"Henrique de Salusse Lussac Filho.";"Idem";"Novo systema destinado á fiscalisação de bonds, traniways, estradas de ferro, transporte fluvial e maritimo, etc., denominado - Fise System."
"3.194";"14";"Dr. John James Marchant";"Idem";"Apparelho gerador de acetylene, denominado -Gerador moderno."
"3.195";"14";"Percy Henry Mkimon";"Idem";"Estante-mosirador aperfeiçoada."
"3.196";"14";"Antonio Baptista da Silva Aguiar.";"Estado de Minas Geraes.";"Novo systema formicida e machina para esse fim, denominada - Salvadora da lavoura."
"3.197";"14";"Francisco Pedro de Souza e Mello.";"Estado de S. Paulo";"Novo systema de torrador de café, denominado - Torrador Souza e Mello."
"3.198";"14";"Verissimo Barbosa de Souza";"Capital Federal.";"Motor de pressão de ar."
"3.199";"14 novembro";"Evaristo C. Engelberg e Pedro A. Engelberg.";"Estado de S. Paulo";"Novo descascador Engelberg, para descascar café, arroz e outros grãos. do café os grãos"
"3.200";"14";"Idem";"Idem";"Catador Engelberg para separar mais leves e mal desenvolvidos, corpos estranhos, como qualquer casca."
"3.201";"14";"Xavier Junior & C.";"Capital Federal.";"Descascador ventilador para arroz, denominado -Descascador Xavier."
"3.202";"14 """;"Armand Allendy.";"França";"Dispositivo para cocção dos alimentos."
"3.203";"14 "" """;"Emil Georgir";"Allemanha";"Machina de fazer cigarros com mecanismo auto- matico para enrolar tabaco."
"3.204";"14 """;"Anders Christian Andersen e Laurito Saphus Andersen";"Dinamarca";"Processo para manter automaticamente em pressão constante o ar contido nos aros pneumaticos para rodas e apparelho para o mesmo fim."
"3.205";"14";"Pierre Lapertot, Gilbert Villard e Laurent Pignaud.";"França.";"Applicação das correntes electricas sobrevoltadas e interrompidas, para illuminação por lampadas electricas, por meio dos apparelhos, denominados -Transladores levantadores."
"3.206";"14 """;"John Milton.";"Estados Unidos da America do Norte.";"Aperfeiçoamentos em fornalhas de caldeiras a vapor."
"3.207";"14 "" """;"Samuel Morris Lilis.";"Idem";"Processo industrial para tratar soluções e appa- relho para este fim."
"3.208";"14";"Paul Lucas.";"Allemanha";"Nova lampada de incandescencia para illuminação pelo gaz."
"3.209";"14 "" """;"Joaquim Vieira Ferreira Sobrinho. Domingos Xavier Martins";"Capital Federal. Idem";"Componedor musical. Gazometro denominado-Acetyleno Xavier."
"3.210 3.211";"17 "" "" 17 """;"Antonio Joaquim de Almeida e João Victorino Filho.";"Idem";"Systema de caixões funebres hygienicos e imper- meaveis. de"
"3.212";"23 "" """;"José Candido Gomes Tinoco e Julio Bueno Soares de Gouvêa.";"Idem";"Aperfeiçoamentos em apparelhos centrifugos pulverisação para a applicação desses apparelhos a pulverisação do sal ou outras materias hu- midas."
"3.213";"23 de novembro de 1900.";"Casimir James Head e Roland Cecil Wild.";"Inglaterra";"Processo aperfeiçoado para tratamento de minerios de tilluretos."
"3.214";"23 "" """;"Coronel Alfredo Ernesto Jacques Ouriques e João de Simas Enéas.";"Capital Federal.";"Argamassa denominada - Kaolinite."
"3.215";"24 "" "" """;"Emilio Gottschalk e Alberto Graf.";"Estado de S. Paulo";"Processo para o fabrico, petrificação e endureci- mento rapido de granito, pedras artificiaes e semelhantes."
"3.216";"24 "" "" """;"Alberto C. King";"Capital Federal.";"Apparelho geradar de gaz, denominado-Apparelho King."
"3.217";"24 "" "" """;"François Edouard Vilatte";"Republica Argentina.";"Apparelho formicida automatico."
"3.218";"24 "" """;"Adolpho Sayon.";"França";"Moldes moveis para córtes."
"3.219";"29 """;"Thomaz Rowland Jordan";"Estados Unidos da America do Norte.";"Aperfeiçoamentos em pulverisadores."
"3.220";"29 """;"Idem";"Idem";"Aperfeiçoamentos em apparelho de amalgamação."
"3.221";"29 "" """;"Idem";"Idem";"Aperfeiçoamentos em apparelhos para separação de minerios."
"3.222";"29 """;"Societé Preduart, Blanc & C";"Suissa.";"Apparelho distribuidor automatico."
"3.223";"29 "" """;"Theophilo Henriques de Sant'Anna.";"Capital Federal.";"Processo para fabricação de graxas e lubrificantes."
"3.224";"29 """;"José Francisco de Oliveira Moraes e Frederico Rodrigues de Faria";"Idem";"Fecho ou fechadura de segurança."
"3.225):";"30 "" "" "" """;"Manoel Corrêa de Almeida.";"Idem";"Novo systema de machinas para fabricar farinha, polvilho de mandioca e outras."
"3.226";"30 "" """;"João de Castro Lima e Silva";"Idem";"Tres bancos-carteiras escolares a que denominou -Municipal, Republica e Estrella."
"3.227";"6 "" dezembro """;"Henock Romidoff.";"Idem";"Indicador hydro-auto-regulador, systema uni- versal, para os serviços dos depositos d'agua, industriaes e domesticos."
"3.228";"6 "" """;"Emilio Julio Hess, Severiano An- tonio de Castilho e Manoel Fer- reira Delamare.";"Idem";"Novo processo de utilisação do calor solar por in- termedio do ar liquefeito."
"3.229";"7 "" """;"Arthur Vianna";"Idem";"Tinta denominada <<Forestina""."
"3.330";"7 "" """;"Francisco da Rocha Camargo Ar- ruda.";"Estado de S. Paulo";"Apparelho economico para fabricar gaz de illumi- nação, extrahido de lenha, de palha de café, de turfa e outros combustiveis, denominado-Gazo- metro domestico economico."
"3.331";"7 x "" """;"Reinaldo Arut.";"Estado do Rio Grande do Sul.";"Novo meio de acondicionamento em saccos de cal, farinha, feijão, milho e outros cereaes."
"3.332";"19 "" """;"Guglislino Marconi";"Inglaterra";"Aperfeiçoamentos em apparelhos para telegraphia sem fio."
"3.333";"19 "" """;"Francisco Corrêa";"Estado do Amazonas";"Apparelho para sondagem automatica, denominado -Sondador automatico Corrêa."
"3.334";"19 """;"Companhia Luz Stearica";"Capital Federal.";"Aperferçoamentos em machinas de fundir velas."
"3.335";"27 "" """;"Juan Aramburú";"Republica Argentina";"Plataforma movel para transportar de uma via a outra locomotivas ou vagões de estradas de ferro."
"3.336";"29 "" "" """;"Henrique Thaddeu";"Capital Federal.";"Apparelho destinado a vedar a passagem do gaz quando o medidor se achar inclinado, denomi- nado - Obturador Thadeu."
"3.044";"15 ""   ";"Miguel Guerquim.";"Idem";"Nova mesa elastica denominada - Mesa Michel."
"3.045";"15   ";"Samuel Adolpho Bragi";"Estado de S. Paulo.";"Machina de beneficiar arroz, denominada deseas- cador - Samuel Braga."
"3.016";"15   ";"The Richemond Gold & Silver Cigar- rette Company.";"Estados Unidos da America do Norte.";"Novo systema de mortalha para cigarros."
"3.047";"15   ";"Theodore Miller";"Idem";"Gerador de vapor aperfeiçoado."
"3.048";"15   ";"Charles Alfred Carles de Candem- berg.";"França";"Nova substancia para calçamento ou pavimento de- nominado - Asphalto Cautchntado."
"3.049";"15   ";"Johannes Giesecke";"Allemanha";"Processo para producção de chapas para impressão das meias tintas, denominado - Gigantolypia."
"3.050";"15   ";"Manetho Côrtez, Jeckson. John Maria Donough e Arthur John Clark.";"Estados Unidos da America do Norte.";"Aperfeiçoamentos em machinas de furar rochas."
"3.051";"23   ";"Gottlieb Kahle, Theodor Henjes e Ludwig Beissoer.";"Allemanha";"Armadilhas aperfeiçoadas para apanhar ratos, ca- mondongos e outros animaes damninhos."
"3.052";"23   ";"Theodore Miller";"Estados Unidos da America do Norte.";"Processo para regular automaticamente a producção de vapor em gerador de vapor."
"3.053";"29   ";"Henry Alonzo Buch";"Inglaterra";"Machina rotativa aperfeiçoada."
"3.054";"29   ";"Eduardo B. Kneese";"Estado de S. Paulo";"Bateria electro-galvanica denominada - Bacteria Electro-galvanica de Eduardo B. Kneese."
"3.055";"29   ";"José Pinto Rodrigues de Brito";"Capital Federal.";"Utensilio para limpeza e hygiene das habitações, denominada - Saneador domestico."
"3.056";"31   ";"John James Marchant";"Idem";"Gerador de acetylene."
"3.057";"11 de abril.  ";"Joaquim Severino da Cruz.";"Estado de S. Paulo";"Fecho de segurança - Joaquim Cruz."
"3.058";"11 ""   ";"Emile Barbet";"França";"Aperfeiçoamentos em processo de fermentações in- dustriaes e sua utilisação."
"";"";"";"";""
"2.575 (bis)";"23 de maio de 1900";"Rodolpho Schomaker";"Estado de Minas Geraes";"Melhoramentos introduzidos na invenção já privilegiada, de formicida, denominada - Morte instantanea."
"2.617 e";"12 de dez. de 1900";"José Alves Ribeiro de Car- valho.";"Capital Federal";"Melhoramentos introduzidos na invenção já privilegiada. de grinaldas ou coròas deno- minadas- Grinaldas brazileiras."
"2.616 """;"25 de abeil de 1900";"Victor Camis e Anselmo Gobba";"Italia";"Me'horamentos introduzidos na invenção, já privilegiada, de uns aperfeiçoamentos nos ap- parelhos recuperadores do oleo de lubrificação."
"2.627 (ter)";"21 de dez. de 1900";"Eduardo Augusto Pereira Nunes.";"Capital Federal";"Melhoramentos introduzidos na invenção, já privilegiada, de um preparado denominado - Formicidina Paranaense."
"2.731 (bis)";"30 de agosto de 1900";"Dr. Francisco Custodio de Barros.";"Idem";"Melhoramentos introduzidos na invenção. já privilegiada, de um preparado denominado - Rheumatina, applicado ao tratamento do rheamatismo, molestias cutaneas, syphiliti- cas e outras affecções dolorosas."
"2.733 """;"8 de jan. de 1900";"William Henry Porter";"Estados Unidos da Ame- rica do Norte.";"Melhoramentos introduzidos na invenção, já privilegiada, de uma substancia catalytica estavel para bicos de gaz e bicos para o mesmo."
"2.742 (bis).";"31 de maio de 1900.";"Elias Peterson";"Belgica,";"Melhoramentos introduzidos na invenção, já privilegiada, de um processo de tratamento dos minerios sulfuretados, contendo arsenico, antimonio ou tellurio."
"4 2.745 """;"22 de fev. de 1900.";"A. Balaguer & C.";"Capital Federal";"Melhoramentos introduzidos na invenção, ja priviligiada, de um apparelho para destrui- ção das formigas e outros insectos damninhos denominado - Insecticida Brazil."
"2.786";"16 de junho de 1900";"Guglielmo Marconi";"Inglaterra";"Melhoramentos introduzidos na invenção, já privilegiada, de apparelhos empregados em telegraphia sem fios."
"2.813";"22 de fev. de 1900.";"Hime & C.";"Capital Federal";"Melhoramentos introduzidos na invenção, já privilegiada, de ferros de engommar com grelhas aperfeiçoadas."
"2.867";"10 de março de 1900";"A. Euterpino Borges.";"Idem.";"Melhoramentos introduzidos na invenção já privilegiada, de apparelho automatico gera- dory de gaz acetileno, dispensando o gazome- tro."
"2867, (ter),";"14 de set. de 1900.";"Idem";"Idem";"Idem, idem."
"2.942 (bis):";"20 de abril de 1900.";"Aloys Driesler e Georg Mas- chke.";"Idem";"Melhoramentos introduzidos na invenção, já privilegiada, de um processo de purificação e liquefação de acido carbonico obtido pelo prosesso de fermentação alcolica."
"2.950 """;"14 de nov. de 1900.";"Carlos Ernesto de Miranda .";"Idem";"Melhoramentos introduzidos na invenção já privilegiada, de aperfeiçoamentos em rodas para carros, carroças e vehiculos semelhan- tes."
"3.012";"8 de março de 1900";"Companhia Nacional Manu- factora de Fumos.";"Idem";"Melhoramentos introduzidos na invenção, já privilegiada, de uma caixinha-cigarreira."
"3.014";"3 de agosto de 1900";"Carlos Piquet";"Idem";"Melhoramentos introduzidos na invenção já privilegiada, de carteira para cigarros ou charutos denominada - Carteira fiscalisa- dora."
"";"";"";"";""
"1";"20 de janeiro de 1900.";"Fernand Eugene Del- croix.";"Capital Federal";"Um combustor especial para a illuminação a gaz por incandescencia denominado - Bico Delcroix."
"2";"25 "" "" "" """;"Alfredo Emilio Pacheco de Mello.";"Idem";"Apparelho destinado á lavagem e desinfecção de latrinas, mictorios, vallas, receptaculos de aguas servidas, etc., denominado - De- sinfectador automatico."
"3";"27 "" "" """;"Dr. José Augusto Qui- rino dos Santos.";"Estado de S. Paulo.";"Um novo meio para augmentar o alcance dos projectis, lançados pelas carabinas e outras armas de guerra e caça."
"4";"27 "" "" """;"Idem";"Idem";"Um novo systema de luz electrica, denominado - Systema Lecroix - Quirino."
"5";"27 "" "" "" """;"João Tiburcio Fiuza de Lima.";"Estado de Pernambueo.";"Cadeira - Salva-vida."
"6";"19 fevereiro de """;"Antoriio Joaquim Peixoto de Castro e Mary Haas.";"Capital Federal.";"Fôrma aperfeiçoada para esfriar sabão deno- minada - Peixoto-Haas."
"T";"22 "" "" "" """;"Pedro Antonio Sant'An- gelo.";"Estado de S. Paulo";"Separador para café denominado - Separador Cylindro Santingelo - dito machina typo A."
"8";"22 "" "" "" """;"Idem";"Idem";"Ventilador para café, denominado - Ventila- dor Singelo Santangelo-dito machina typo B."
"9";"22 "" "" "" """;"Idem";"Idem";"Descascador para café, denominado - Descas- cador Santangelo - dito machina typo C."
"10";"22 "" "" """;"Idem";"|Idem";"Ventilador duplo denominado - Ventilador duplo Santangelo - dito machina typo D."
"11";"22 "" "" """;"Idem";"Idem";"Brunidor de café, denominado - Brunidor de café Santangelo - dito machina typo E."
"12";"22";"Idem";"Idem";"Catador para café denominado - Catador uni- forme Santangelo - dito machina typo F."
"13";"22 "" """;"Idem";"Idem";"Separador completo para café denominado - Separador cylindrico completo Santangelo- dito machina typo G."
"14";"7 "" março";"Alfredo Angelo";"Capital Federal";"Um motor-continuo"
"15";"8 "" """;"Roberto Stuve.";"Estado do Rio de Janeiro.";"Gravata separavel."
"16";"9 "" "" """;"João Cateysson";"Capital Federal";"Apparelhos distribuidores automaticos de mer- cadorias."
"17";"9 "" """;"Luiz Deumond Fran- klin.";"Estado de Minas Geraes";"Uma chaminé aperfeiçoada destinada a loco- motivas empregando carvão e madeira como combustivel."
"18";"13";"Elesião Linhares Pereira";"Estado do Espirito Santo.";"Um apparelho para abrir, fechar portas, ja- nellas, etc., de e dificios."
"19";"13";"Pedro Antonio Sant'An- gelo.";"Estado de S. Paulo.";"Engenho para beneficiar café denominado - Engenho de café Brazileiro."
"20";"20";"Affonso Coelho Seabra";"Estado do Rio de Janeiro.";"Um motor para gabinete de dentista e appa- relhos aperfeiçoados para o mesmo."
"21";"26 """;"José Carlos do Patro- cinio.";"Capital Federal";"Apparelho propulsor para aerostatos."
"22";"31";"Emilio Julio Hess";"Idem";"Novo processo de fabricação de gelb."
"23";"7 "" abril";"Jayme Benevolo e João Baptista da Motta.";"Idem";"Uma nova applicação de valvulas de qualquer systema, aos medidores de gaz da illumi- nação com o fim de impedir a retirada de agua dos mesmos, quer por meio de com- pressão quer por meio de aspiração do ar."
"";"";"";"";""
"24";"14 de abril de 1900";"Dr. Francisco de Paula oreira Mourão.";"Estado de Minas Geraes";"Applicação nova do oxydo de manganez, bem como dos seus compostos e derivados, á con- fecção da posta de argilla destinada a ce- ramica."
"25 26";"19 "" "" "" 19";"Ameand Lamothe. Euzebio Maximiano Pi- res Ferreira.";"Estado do Rio de Janeiro. Capital Federal";"Nova roda propulsora. Trave para bonds auxiliada pelo movimento do proprio bond, denominada - Trave auxiliar."
"27";"19 """;"Joaquim de Oliveira e Souza.";"Estado de Minas Geraes";"Apparelho para alisar e brunir palhas para cigarros e outros fins."
"28";"23";"Alberto Fernandes de Souza";"Capital Federal";"Um apparelho denominado - Rapido auxiliar."
"29";"23";"Fernando Pinheiro Paes Leme.";"Estado do Rio de Janeiro.";"Applicação da cortiça do campo ou pão santo (Kielmeyera) para formar substancia do ca- loris."
"30";"2 maio";"Vicente di Martino";"Capital Federal";"Um cartão reclame denominado - Bilhete re- clame systema V. di Martino."
"31";"29";"Alfredo de Simas Enéas.";"Idem";"Um systema de fechamento e impermeabilidade dos caixões para o transporte de cadaveres afim de evitar a contaminação pelos gazes da decomposição, durante o trajecto dos mortos para os cemiterios."
"32";"20 junho";"Manoel de Miranda Ro- sa e Ernest Charles Dealtry.";"Idem";"Apparelho para obter força motriz sem appli cação de qualquer combustivel ou outro modo até hoje conhecido."
"33";"3 de julho";"Arthur Diniz Lagarde";"Estado do Rio de Janeiro.";"Coupons fiscaes, para tramway, bond ou es- tradas de ferro, transporte maritimo ou fluvial."
"34";"3";"Idem";"Idem";"Impermeabilidade dos tecidos"
"35";"9 """;"Henrique Meilck e Fre- derico Brinder.";"Estado do Pará";"Processo de preparação de uma massa de pe- dra artificial, denominada - Pedralitta-Can- taria."
"35";"9";"Idem";"Idem";"Processo para fabrico de parallelipipedos arti- ficiaes denominados - Parallelipipedos Fun- litto."
"37";"";"Idem";"Idem";"Processo para preparo de pedras de alvenaria de tijolo denominado - Tijolo Aveiacalitho."
"38";"9";"Feliciano Pires de Abreu Sodré.";"Estado do Rio de Janeiro.";"Cartões para ensino escolar, denominados - Cartões escolares Sodré."
"39";"";"Giuseppe Marchi";"Capital Federal";"Apparelho aperfeiçoado para producção de gaz acetyleno."
"40";"13";"Joaquim José Ramos Maia.";"Idem";"Uma cadeira portatil que denomina - Brazil."
"41";"25";"Alexandre Miranda";"Idem";"Uma nova carteira para cigarros denominada - Indicadores."
"42";"27";"Lucas Peclonau e Char- les Gabriel.";"Idem";"Novo processo de desagregação das plantas textis."
"43";"27";"Carlos Silva";"Estado de s. Paulo.";"Fogão aperfeiçoado denominado - Fogão Car- los Silva."
"44";"3 "" agosto";"Coronel Alfredo Ernesto Jacques Ouriques e João de Simas Enéas.";"Capital Federal";"Argamassa destinada ao fabrico de isoladores electricos e quaesquer objectos em que seja necessario o emprego de uma argamassa impermeavel e resistente."
"45";"9 """;"João Ferreira Corrêa e José Mendes Ribeiro Camargo.";"Idem";"Um novo kalendario de desfolhar, intitulado - Kalendario Commercial."
"46";"14 de agosto de 1900.";"Francisco Paulino de Carvalho.";"Capital Federal";"Apparelho desinfectador automatico de la- trinas."
"47";"14 "" """;"João Cordeiro da Graça.";"Idem";"Apparelho patente para descarregar carvão e outros materiaes."
"48";"17 """;"Dr. Fernando Ferreira da Costa.";"Idem";"Processo para extrahir o amido das bananas em estado de pureza."
"49";"1 "" setembro de 1900.";"Antonio Candido Borges";"Idem";"Apparelho denominado - Gravador mecanico para o fabrico de assucar."
"50";"4 """;"Edwin Montague Wilkes, Emilio Julio Hess e Severiano Antonio de Castilho.";"Idem";"Um invento relativo ao emprego do ar lique- feito como força motora économica."
"51";"6";"Euzebio Maximiano Pi- res Ferreira.";"Idem";"Um novo systema de elasticos com ilhões ou ventiladores para sapatos, denominados - Hygienicos."
"52";"15 "" """;"Frederico Carlos da Cu- nha Junior.";"Idem";"Um apparelho destinado a fiscalisar o numero de passageiros em vehiculos publicos, deno- minado - Chronometro Fiscal."
"53";"24 "" """;"Manoel Cabral dos San- tos.";"Estado de S. Paulo";"Telegraphia sem pilhas Cabral"
"54";"28 "" """;"Engenheiro Civil Emilio Julio Hess.";"Capital Federal";"Um novo processo de utilisação do calor solar por intermedio do ar liquifeito."
"55";"28 "" "" "" """;"Idem";"Idem";"Um novo processo economico de fabricação do ar liquefeito."
"56";"8 outubro";"Thomaz Placido Teixeira de Faria.";"Idem";"Um pequeno apparelho destinado a fiscalisar as rendas dos bonds por meio de coupons de- nominado - Pregador coupon."
"57";"10 "" "" n";"Leandro Gomes Ribeiro.";"Idem";"Systema de processo de fiscalisação denominado - Systema de fiscalisação de bonds."
"58";"27 * > """;"Ernesto Gentilini";"Estado do Rio Grande do do Sul.";"Apparelho para produzir força util e continua."
"59";"23 novembro";"Domingos da Silva Araujo Lopes.";"Capital Federal";"Processo para ambrear cigarros e machinas para esse fim."
"60";"21 dezembro 1900.";"Euzebio Maximiano Pires Ferreira.";"Idem";"Novo systema de tingir pela electricidade, utilisando-se para este fim dos apparelhos communs de tinturaria."
"61";"27 "" "" "" """;"Angelo Casagrande";"Estado de Minas Geraes.";"Machina para extrahir as fibras do tronco e das folhas da bananeira."
